{
  "id": "cert-in-non-annexure-i-type",
  "description": "The user attests that a simple hardware failure is NOT an Annexure I incident type.",
  "entity_profile": {
    "entity_class": "body_corporate",
    "is_listed": false,
    "holds_personal_data": true,
    "uses_protected_systems": false,
    "is_regulated_cloud_vps": false
  },
  "incident_facts": {
    "description": "Simple hardware failure of a redundant switch.",
    "incident_types": [
      "hardware failure"
    ],
    "when_detected": "2026-09-15T10:00:00+05:30",
    "when_noticed": "2026-09-15T10:00:00+05:30",
    "when_occurred": "2026-09-15T10:00:00+05:30",
    "personal_data_involved": false,
    "systems_affected": [
      "network_switch"
    ],
    "is_annexure_i_type": false
  },
  "law_snapshot_date": "2026-09-24",
  "expected": {
    "law_as_of": "2026-09-15",
    "regulators": [
      "CERT-In"
    ],
    "deadlines": [],
    "citations": [
      {
        "obligation_id": "cert-in.directions-70b.2022.ntp-sync",
        "instrument_id": "cert-in.directions-70b.2022",
        "paragraph_ref": "Direction (i)"
      },
      {
        "obligation_id": "cert-in.directions-70b.2022.designate-poc",
        "instrument_id": "cert-in.directions-70b.2022",
        "paragraph_ref": "Direction (iii)"
      },
      {
        "obligation_id": "cert-in.directions-70b.2022.log-retention-180d",
        "instrument_id": "cert-in.directions-70b.2022",
        "paragraph_ref": "Direction (iv)"
      }
    ],
    "required_evidence": [],
    "not_applicable": [
      {
        "regulator": "CERT-In",
        "obligation_id": "cert-in.directions-70b.2022.incident-reporting-6h",
        "reason": "User attested the incident is not an Annexure I type"
      },
      {
        "regulator": "CERT-In",
        "obligation_id": "cert-in.directions-70b.2022.vps-cloud-vpn-customer-data-5y",
        "reason": "Direction (v) names only data centres, VPS, cloud and VPN providers"
      },
      {
        "regulator": "CERT-In",
        "obligation_id": "cert-in.directions-70b.2022.virtual-asset-kyc-5y",
        "reason": "Direction (vi) names only virtual asset service, exchange and custodian wallet providers"
      }
    ],
    "unknowns": []
  },
  "adversarial_flags": [
    "explicit_attestation"
  ],
  "split": "dev",
  "labels_source": "CERT-In Directions 70B dated 28 April 2022 (primary text)",
  "source_quotes": [
    {
      "document": "cert-in.directions-70b.2022",
      "page": 2,
      "quote": "(i) All service providers, intermediaries, data centres, body corporate and \nGovernment organisations shall connect to the Network Time Protocol \n(NTP) Server of National Informatics Centre (NIC) or National Physical \nLaboratory (NPL) or with NTP servers traceable to these NTP servers, for \nsynchronisation of all their ICT systems clocks. Entities having ICT \ninfrastructure spanning multiple geographies may also use accurate and \nstandard time source other than NPL and NIC, however it is to be ensured \nthat their time source shall not deviate from NPL and NIC."
    },
    {
      "document": "cert-in.directions-70b.2022",
      "page": 2,
      "quote": "(ii) Any service provider, intermediary, data centre, body corporate and \nGovernment organisation shall mandatorily report cyber incidents as \nmentioned in Annexure I to CERT-In within 6 hours of noticing such \nincidents or being brought to notice about such incidents."
    }
  ]
}
