{
  "$schema": "../../schema/benchmark_scenario.schema.json",
  "id": "rbi-contradictory-attestation-caveat",
  "description": "A negative RBI cyber-incident attestation controls applicability but conflicts visibly with a ransomware type match.",
  "entity_profile": {"entity_class": "nbfc.middle_layer", "is_listed": false, "holds_personal_data": false, "uses_protected_systems": false, "is_regulated_cloud_vps": false},
  "incident_facts": {"description": "Ransomware incident", "incident_types": ["Malicious code attacks such as Ransomware"], "is_cyber_incident": false, "when_detected": "2026-10-01T10:00:00+05:30", "when_noticed": "2026-10-01T10:00:00+05:30", "systems_affected": ["server"]},
  "law_snapshot_date": "2026-10-04",
  "expected": {
    "law_as_of": "2026-10-01",
    "regulators": ["CERT-In", "RBI"],
    "deadlines": [{"regulator": "CERT-In", "obligation_id": "cert-in.directions-70b.2022.incident-reporting-6h", "anchor": "noticing", "deadline_iso8601": "PT6H", "deadline_timestamp": "2026-10-01T16:00:00+05:30"}],
    "citations": [{"obligation_id": "cert-in.directions-70b.2022.incident-reporting-6h", "instrument_id": "cert-in.directions-70b.2022", "paragraph_ref": "Direction (ii)"}],
    "required_evidence": [],
    "not_applicable": [
      {"regulator": "RBI", "obligation_id": "rbi.nbfc-cyber.2026.ch4-incident-reporting-6h", "reason": "Chapter IV class mismatch"},
      {"regulator": "RBI", "obligation_id": "rbi.nbfc-cyber.2026.ch5-incident-reporting-6h", "reason": "user attested not a cyber incident"},
      {"regulator": "RBI", "obligation_id": "rbi.nbfc-cyber.2026.ch5-cert-in-notification", "reason": "user attested not a cyber incident"},
      {"regulator": "RBI", "obligation_id": "rbi.nbfc-cyber.2026.ch5-hfc-incident-reporting-nhb", "reason": "Entity is not an HFC"}
    ],
    "unknowns": [],
    "time_critical": [],
    "caveats_contain": ["re-check"]
  },
  "adversarial_flags": ["negative_attestation_controls", "contradiction_is_disclosed"],
  "split": "dev",
  "labels_source": "docs/LABELS_RBI.md Amendment 1; RBI paragraph 4(7); CERT-In Annexure I",
  "source_quotes": [{"document": "rbi.nbfc-cyber.2026", "page": 4, "quote": "‘Cyber Incident’ - A cyber event that adversely affects the cybersecurity of \nan information asset whether resulting from malicious activity or not."}]
}
