{
  "$schema": "../../schema/benchmark_scenario.schema.json",
  "id": "irdai-intermediary-brought-to-notice",
  "description": "An insurance intermediary is told of the incident by a third party; no noticing time is given.",
  "entity_profile": {
    "entity_classes": [
      "irdai.intermediary"
    ],
    "is_listed": false,
    "holds_personal_data": false,
    "is_regulated_cloud_vps": false
  },
  "incident_facts": {
    "description": "An insurance intermediary is told of the incident by a third party; no noticing time is given.",
    "incident_types": [
      "Malicious code attacks such as Ransomware"
    ],
    "systems_affected": [
      "Policy administration system"
    ],
    "when_brought_to_notice": "2026-10-01T09:00:00+05:30"
  },
  "law_snapshot_date": "2026-10-04",
  "expected": {
    "law_as_of": "2026-10-01",
    "regulators": [
      "CERT-In",
      "IRDAI"
    ],
    "deadlines": [
      {
        "obligation_id": "cert-in.directions-70b.2022.incident-reporting-6h",
        "regulator": "CERT-In",
        "anchor": "brought_to_notice",
        "deadline_iso8601": "PT6H",
        "deadline_timestamp": "2026-10-01T15:00:00+05:30"
      },
      {
        "obligation_id": "irdai.ics-guidelines.2023.incident-reporting-6h",
        "regulator": "IRDAI",
        "anchor": "brought_to_notice",
        "deadline_iso8601": "PT6H",
        "deadline_timestamp": "2026-10-01T15:00:00+05:30"
      }
    ],
    "citations": [
      {
        "obligation_id": "cert-in.directions-70b.2022.incident-reporting-6h",
        "instrument_id": "cert-in.directions-70b.2022",
        "paragraph_ref": "Direction (ii)"
      },
      {
        "obligation_id": "irdai.ics-guidelines.2023.incident-reporting-6h",
        "instrument_id": "irdai.ics-guidelines.2023",
        "paragraph_ref": "Policy 2.10, 3.5 item 3"
      }
    ],
    "required_evidence": [],
    "not_applicable": [],
    "unknowns": []
  },
  "adversarial_flags": [
    "alternative_anchor"
  ],
  "split": "dev",
  "labels_source": "docs/LABELS_IRDAI.md (written before ingestion and implementation)",
  "source_quotes": [
    {
      "document": "irdai.ics-guidelines.2023",
      "page": 224,
      "quote": "Organization shall mandatorily report cyber incidents to \nCert-In within 6 hours of noticing or being brought to \nnotice about such incidents with a copy to IRDAI and \nother concerned regulators / authorities. The details \nregarding methods and formats of reporting cyber \nincident is published on Cert-In website."
    },
    {
      "document": "irdai.ics-guidelines.2023",
      "page": 138,
      "quote": "These guidelines are applicable to all Insurers including Foreign Re-Insurance Branches (FRBs) and \nInsurance Intermediaries regulated by the Insurance Regulatory and Development Authority of \nIndia (IRDAI)."
    },
    {
      "document": "cert-in.directions-70b.2022",
      "page": 2,
      "quote": "(ii) Any service provider, intermediary, data centre, body corporate and \nGovernment organisation shall mandatorily report cyber incidents as \nmentioned in Annexure I to CERT-In within 6 hours of noticing such \nincidents or being brought to notice about such incidents. The incidents can \nbe reported to CERT-In via email (incident@cert-in.org.in), Phone (1800-\n11-4949) and Fax (1800-11-6969). The details regarding methods and \nformats of reporting cyber security incidents is also published on the \nwebsite of CERT-In www.cert-in.org.in and will be updated from time to \ntime."
    }
  ]
}
