{
  "$schema": "../../schema/benchmark_scenario.schema.json",
  "id": "rbi-anchor-occurrence-vs-detection",
  "description": "Adversarial anchor test: An NBFC detects an incident at 08:00 IST which occurred at 06:00 IST. The Directions specify detection or occurrence; the earlier trigger anchors the clock.",
  "entity_profile": {
    "entity_class": "nbfc.middle_layer",
    "is_listed": false,
    "holds_personal_data": false,
    "uses_protected_systems": false,
    "is_regulated_cloud_vps": false
  },
  "incident_facts": {
    "description": "Unauthorized access occurred at 06:00 and detected at 08:00 IST.",
    "incident_types": [
      "Unauthorised access of IT systems/data"
    ],
    "annexure_i_items": [
      "annexure_i.ii"
    ],
    "when_detected": "2026-08-15T08:00:00+05:30",
    "when_noticed": "2026-08-15T08:00:00+05:30",
    "when_occurred": "2026-08-15T06:00:00+05:30",
    "when_aware": "2026-08-15T08:00:00+05:30",
    "personal_data_involved": false,
    "systems_affected": [
      "Server"
    ],
    "is_annexure_i_type": null
  },
  "law_snapshot_date": "2026-08-15",
  "expected": {
    "law_as_of": "2026-08-15",
    "regulators": [
      "CERT-In",
      "RBI"
    ],
    "deadlines": [
      {
        "obligation_id": "cert-in.directions-70b.2022.incident-reporting-6h",
        "regulator": "CERT-In",
        "anchor": "noticing",
        "deadline_iso8601": "PT6H",
        "deadline_timestamp": "2026-08-15T08:30:00Z"
      },
      {
        "obligation_id": "rbi.nbfc-cyber.2026.incident-reporting-6h",
        "regulator": "RBI",
        "anchor": "occurrence",
        "deadline_iso8601": "PT6H",
        "deadline_timestamp": "2026-08-15T06:30:00Z"
      }
    ],
    "citations": [
      {
        "obligation_id": "rbi.nbfc-cyber.2026.incident-reporting-6h",
        "instrument_id": "rbi.nbfc-cyber.2026",
        "paragraph_ref": "Paragraph 14"
      }
    ],
    "required_evidence": [],
    "not_applicable": [],
    "unknowns": []
  },
  "adversarial_flags": [
    "ambiguous_anchor"
  ],
  "split": "dev",
  "labels_source": "RBI NBFC Cybersecurity Directions 2026 Paragraph 14 (detection or occurrence)"
}
