{
  "$schema": "../../schema/benchmark_scenario.schema.json",
  "id": "dpdp-fiduciary-data-breach-simulated-2027",
  "description": "In June 2027 (when DPDP is in force), a Data Fiduciary discovers and becomes aware of a personal data breach affecting customers.",
  "entity_profile": {
    "entity_class": "dpdp.data_fiduciary",
    "is_listed": false,
    "holds_personal_data": true,
    "uses_protected_systems": false,
    "is_regulated_cloud_vps": false
  },
  "incident_facts": {
    "description": "Customer database exfiltrated; entity became aware on 2027-06-01 at 10:00 IST.",
    "incident_types": [
      "Data breach"
    ],
    "annexure_i_items": [
      "annexure_i.xi"
    ],
    "when_detected": "2027-06-01T10:00:00+05:30",
    "when_noticed": "2027-06-01T10:00:00+05:30",
    "when_occurred": "2027-05-30T10:00:00+05:30",
    "when_aware": "2027-06-01T10:00:00+05:30",
    "personal_data_involved": true,
    "systems_affected": [
      "Customer DB"
    ],
    "is_annexure_i_type": null
  },
  "law_snapshot_date": "2027-06-01",
  "expected": {
    "law_as_of": "2027-06-01",
    "regulators": [
      "CERT-In",
      "MeitY"
    ],
    "deadlines": [
      {
        "obligation_id": "cert-in.directions-70b.2022.incident-reporting-6h",
        "regulator": "CERT-In",
        "anchor": "noticing",
        "deadline_iso8601": "PT6H",
        "deadline_timestamp": "2027-06-01T10:30:00Z"
      },
      {
        "obligation_id": "meity.dpdp-rules.2025.rule7-2-board-detailed",
        "regulator": "MeitY",
        "anchor": "awareness",
        "deadline_iso8601": "PT72H",
        "deadline_timestamp": "2027-06-04T04:30:00Z"
      }
    ],
    "citations": [
      {
        "obligation_id": "cert-in.directions-70b.2022.incident-reporting-6h",
        "instrument_id": "cert-in.directions-70b.2022",
        "paragraph_ref": "Direction (ii)"
      },
      {
        "obligation_id": "meity.dpdp-rules.2025.rule7-1-board-initial",
        "instrument_id": "meity.dpdp-rules.2025",
        "paragraph_ref": "Rule 7(1)"
      },
      {
        "obligation_id": "meity.dpdp-rules.2025.rule7-2-board-detailed",
        "instrument_id": "meity.dpdp-rules.2025",
        "paragraph_ref": "Rule 7(2)"
      },
      {
        "obligation_id": "meity.dpdp-rules.2025.rule7-3-principal-intimation",
        "instrument_id": "meity.dpdp-rules.2025",
        "paragraph_ref": "Rule 7(3)"
      }
    ],
    "required_evidence": [
      "detailed breach report",
      "root cause analysis"
    ],
    "not_applicable": [],
    "unknowns": []
  },
  "adversarial_flags": [],
  "split": "dev",
  "labels_source": "DPDP Rules 2025 Rule 7 (Gazette 13 Nov 2025) and CERT-In Directions 70B"
}
