{
  "$schema": "../../schema/benchmark_scenario.schema.json",
  "id": "sebi-anchor-detection-earlier",
  "description": "Adversarial anchor test: A Qualified RE has detection logged at 08:00 IST by automated SIEM, but manual noticing at 10:00 IST. SEBI/CERT-In clock must anchor at the earliest trigger.",
  "entity_profile": {
    "entity_class": "sebi.qsei",
    "is_listed": true,
    "holds_personal_data": false,
    "uses_protected_systems": true,
    "is_regulated_cloud_vps": false
  },
  "incident_facts": {
    "description": "Automated SIEM alert detected attack at 08:00; SOC operator noticed at 10:00.",
    "incident_types": [
      "Attacks on servers such as Database, Mail and DNS"
    ],
    "annexure_i_items": [
      "annexure_i.iv"
    ],
    "when_detected": "2025-06-01T08:00:00+05:30",
    "when_noticed": "2025-06-01T10:00:00+05:30",
    "when_occurred": "2025-06-01T07:30:00+05:30",
    "when_aware": "2025-06-01T10:00:00+05:30",
    "personal_data_involved": false,
    "systems_affected": [
      "Trading DB"
    ],
    "is_annexure_i_type": null
  },
  "law_snapshot_date": "2025-06-01",
  "expected": {
    "law_as_of": "2025-06-01",
    "regulators": [
      "CERT-In",
      "SEBI"
    ],
    "deadlines": [
      {
        "obligation_id": "cert-in.directions-70b.2022.incident-reporting-6h",
        "regulator": "CERT-In",
        "anchor": "noticing",
        "deadline_iso8601": "PT6H",
        "deadline_timestamp": "2025-06-01T10:30:00Z"
      },
      {
        "obligation_id": "sebi.cscrf.2024.incident-reporting-6h",
        "regulator": "SEBI",
        "anchor": "detection",
        "deadline_iso8601": "PT6H",
        "deadline_timestamp": "2025-06-01T08:30:00Z"
      }
    ],
    "citations": [
      {
        "obligation_id": "sebi.cscrf.2024.incident-reporting-6h",
        "instrument_id": "sebi.cscrf.2024",
        "paragraph_ref": "Paragraph 2"
      }
    ],
    "required_evidence": [],
    "not_applicable": [],
    "unknowns": []
  },
  "adversarial_flags": [
    "ambiguous_anchor"
  ],
  "split": "dev",
  "labels_source": "SEBI CSCRF Paragraph 2 alternative anchors (noticing or detection)"
}
