{
  "$schema": "../../schema/benchmark_scenario.schema.json",
  "id": "rbi-nbfc-top-layer-cloud-outage",
  "description": "An NBFC (Top Layer) detects an attack on critical core banking and loan servers on 2026-09-10 at 10:00 IST.",
  "entity_profile": {
    "entity_class": "nbfc.top_layer",
    "is_listed": true,
    "holds_personal_data": true,
    "uses_protected_systems": true,
    "is_regulated_cloud_vps": false
  },
  "incident_facts": {
    "description": "Critical database server attack detected at 10:00 IST.",
    "incident_types": [
      "Attacks on servers such as Database, Mail and DNS"
    ],
    "annexure_i_items": [
      "annexure_i.iv"
    ],
    "when_detected": "2026-09-10T10:00:00+05:30",
    "when_noticed": "2026-09-10T10:00:00+05:30",
    "when_occurred": "2026-09-10T09:00:00+05:30",
    "when_aware": "2026-09-10T10:00:00+05:30",
    "personal_data_involved": false,
    "systems_affected": [
      "Core DB"
    ],
    "is_annexure_i_type": null
  },
  "law_snapshot_date": "2026-09-10",
  "expected": {
    "law_as_of": "2026-09-10",
    "regulators": [
      "CERT-In",
      "RBI"
    ],
    "deadlines": [
      {
        "obligation_id": "cert-in.directions-70b.2022.incident-reporting-6h",
        "regulator": "CERT-In",
        "anchor": "noticing",
        "deadline_iso8601": "PT6H",
        "deadline_timestamp": "2026-09-10T10:30:00Z"
      },
      {
        "obligation_id": "rbi.nbfc-cyber.2026.incident-reporting-6h",
        "regulator": "RBI",
        "anchor": "occurrence",
        "deadline_iso8601": "PT6H",
        "deadline_timestamp": "2026-09-10T09:30:00Z"
      }
    ],
    "citations": [
      {
        "obligation_id": "cert-in.directions-70b.2022.incident-reporting-6h",
        "instrument_id": "cert-in.directions-70b.2022",
        "paragraph_ref": "Direction (ii)"
      },
      {
        "obligation_id": "rbi.nbfc-cyber.2026.incident-reporting-6h",
        "instrument_id": "rbi.nbfc-cyber.2026",
        "paragraph_ref": "Paragraph 14"
      }
    ],
    "required_evidence": [],
    "not_applicable": [],
    "unknowns": []
  },
  "adversarial_flags": [],
  "split": "dev",
  "labels_source": "RBI NBFC Cybersecurity Directions 2026 Paragraph 14 and CERT-In Directions 70B"
}
