{
  "$schema": "../../schema/benchmark_scenario.schema.json",
  "id": "rbi-bl-above-500cr-ransomware",
  "description": "A Base Layer NBFC at or above ₹500 crore receives the Chapter IV reporting duty, not Chapter V duties.",
  "entity_profile": {
    "entity_class": "nbfc.bl_500cr_and_above",
    "is_listed": false,
    "holds_personal_data": false,
    "uses_protected_systems": false,
    "is_regulated_cloud_vps": false
  },
  "incident_facts": {
    "description": "Ransomware incident",
    "incident_types": [
      "Malicious code attacks such as Ransomware"
    ],
    "when_detected": "2026-10-01T10:00:00+05:30",
    "when_noticed": "2026-10-01T10:00:00+05:30",
    "systems_affected": [
      "customer system"
    ]
  },
  "law_snapshot_date": "2026-10-04",
  "expected": {
    "law_as_of": "2026-10-01",
    "regulators": [
      "CERT-In",
      "RBI"
    ],
    "deadlines": [
      {
        "regulator": "CERT-In",
        "obligation_id": "cert-in.directions-70b.2022.incident-reporting-6h",
        "anchor": "noticing",
        "deadline_iso8601": "PT6H",
        "deadline_timestamp": "2026-10-01T16:00:00+05:30"
      },
      {
        "regulator": "RBI",
        "obligation_id": "rbi.nbfc-cyber.2026.ch4-incident-reporting-6h",
        "anchor": "detection",
        "deadline_iso8601": "PT6H",
        "deadline_timestamp": "2026-10-01T16:00:00+05:30"
      }
    ],
    "citations": [
      {
        "obligation_id": "cert-in.directions-70b.2022.incident-reporting-6h",
        "instrument_id": "cert-in.directions-70b.2022",
        "paragraph_ref": "Direction (ii)"
      },
      {
        "obligation_id": "rbi.nbfc-cyber.2026.ch4-incident-reporting-6h",
        "instrument_id": "rbi.nbfc-cyber.2026",
        "paragraph_ref": "Paragraph 28"
      }
    ],
    "required_evidence": [],
    "not_applicable": [
      {
        "regulator": "RBI",
        "obligation_id": "rbi.nbfc-cyber.2026.ch5-incident-reporting-6h",
        "reason": "Chapter V class mismatch"
      },
      {
        "regulator": "RBI",
        "obligation_id": "rbi.nbfc-cyber.2026.ch5-cert-in-notification",
        "reason": "Chapter V class mismatch"
      },
      {
        "regulator": "RBI",
        "obligation_id": "rbi.nbfc-cyber.2026.ch5-hfc-incident-reporting-nhb",
        "reason": "Chapter V class mismatch and not an HFC"
      },
      {
        "regulator": "RBI",
        "obligation_id": "rbi.nbfc-cyber.2026.ch5-va-half-yearly",
        "reason": "Chapter V class mismatch"
      },
      {
        "regulator": "RBI",
        "obligation_id": "rbi.nbfc-cyber.2026.ch5-pt-annual",
        "reason": "Chapter V class mismatch"
      }
    ],
    "unknowns": [],
    "time_critical": []
  },
  "adversarial_flags": [
    "chapter_iv_does_not_leak_into_chapter_v"
  ],
  "split": "dev",
  "labels_source": "RBI NBFC Direction paragraphs 3(3) and 28; CERT-In Direction (ii)",
  "source_quotes": [
    {
      "document": "rbi.nbfc-cyber.2026",
      "page": 3,
      "quote": "(3) \nThe provisions contained in Chapter IV shall be applicable only for NBFCs-\nBL with asset size ₹500 crore and above."
    },
    {
      "document": "rbi.nbfc-cyber.2026",
      "page": 18,
      "quote": "28. The NBFC shall report cyber incidents on DAKSH platform (Reserve Bank’s \nAdvanced Supervisory Monitoring System - https://daksh.rbi.org.in) within six \nhours of detection."
    },
    {
      "document": "cert-in.directions-70b.2022",
      "page": 2,
      "quote": "mentioned in Annexure I to CERT-In within 6 hours of noticing such \nincidents or being brought to notice about such incidents."
    }
  ]
}
