{
  "$schema": "../../schema/benchmark_scenario.schema.json",
  "id": "rbi-aifi-ransomware",
  "description": "An All India Financial Institution: reporting, CERT-In notification, VA and PT all apply.",
  "entity_profile": {
    "entity_classes": [
      "aifi"
    ],
    "is_listed": false,
    "holds_personal_data": false,
    "is_regulated_cloud_vps": false
  },
  "incident_facts": {
    "description": "An All India Financial Institution: reporting, CERT-In notification, VA and PT all apply.",
    "incident_types": [
      "Malicious code attacks such as Ransomware"
    ],
    "systems_affected": [
      "Core banking system"
    ],
    "when_detected": "2026-10-01T10:00:00+05:30",
    "when_noticed": "2026-10-01T10:00:00+05:30"
  },
  "law_snapshot_date": "2026-10-04",
  "expected": {
    "law_as_of": "2026-10-01",
    "regulators": [
      "CERT-In",
      "RBI"
    ],
    "deadlines": [
      {
        "obligation_id": "cert-in.directions-70b.2022.incident-reporting-6h",
        "regulator": "CERT-In",
        "anchor": "noticing",
        "deadline_iso8601": "PT6H",
        "deadline_timestamp": "2026-10-01T16:00:00+05:30"
      },
      {
        "obligation_id": "rbi.aifi-cyber.2026.incident-reporting-6h",
        "regulator": "RBI",
        "anchor": "detection",
        "deadline_iso8601": "PT6H",
        "deadline_timestamp": "2026-10-01T16:00:00+05:30"
      }
    ],
    "citations": [
      {
        "obligation_id": "cert-in.directions-70b.2022.incident-reporting-6h",
        "instrument_id": "cert-in.directions-70b.2022",
        "paragraph_ref": "Direction (ii)"
      },
      {
        "obligation_id": "rbi.aifi-cyber.2026.incident-reporting-6h",
        "instrument_id": "rbi.aifi-cyber.2026",
        "paragraph_ref": "Paragraph 177, first sentence"
      },
      {
        "obligation_id": "rbi.aifi-cyber.2026.cert-in-notification",
        "instrument_id": "rbi.aifi-cyber.2026",
        "paragraph_ref": "Paragraph 177, second sentence"
      },
      {
        "obligation_id": "rbi.aifi-cyber.2026.va-half-yearly",
        "instrument_id": "rbi.aifi-cyber.2026",
        "paragraph_ref": "Paragraph 146 (VA)"
      },
      {
        "obligation_id": "rbi.aifi-cyber.2026.pt-annual",
        "instrument_id": "rbi.aifi-cyber.2026",
        "paragraph_ref": "Paragraph 146 (PT)"
      }
    ],
    "required_evidence": [],
    "not_applicable": [],
    "unknowns": []
  },
  "adversarial_flags": [
    "none_deadline_is_applicable"
  ],
  "split": "dev",
  "labels_source": "docs/LABELS_RBI_BANKS.md (written before implementation)",
  "source_quotes": [
    {
      "document": "rbi.aifi-cyber.2026",
      "page": 39,
      "quote": "177. The AIFI shall report cyber incidents within six hours of detection on DAKSH \nplatform (Reserve Bank’s Advanced Supervisory Monitoring System -\nhttps://daksh.rbi.org.in)."
    },
    {
      "document": "rbi.aifi-cyber.2026",
      "page": 39,
      "quote": "The AIFI shall also pro-actively notify CERT-In regarding \ncyber incidents."
    },
    {
      "document": "rbi.aifi-cyber.2026",
      "page": 35,
      "quote": "146. For critical information systems and / or those in the DMZ having customer \ninterface, VA shall be conducted at least once in every six months and PT at least \nonce in 12 months."
    },
    {
      "document": "rbi.aifi-cyber.2026",
      "page": 4,
      "quote": "These Directions shall be applicable to All-India Financial Institutions"
    },
    {
      "document": "cert-in.directions-70b.2022",
      "page": 2,
      "quote": "(ii) Any service provider, intermediary, data centre, body corporate and \nGovernment organisation shall mandatorily report cyber incidents as \nmentioned in Annexure I to CERT-In within 6 hours of noticing such \nincidents or being brought to notice about such incidents. The incidents can \nbe reported to CERT-In via email (incident@cert-in.org.in), Phone (1800-\n11-4949) and Fax (1800-11-6969). The details regarding methods and \nformats of reporting cyber security incidents is also published on the \nwebsite of CERT-In www.cert-in.org.in and will be updated from time to \ntime."
    }
  ]
}
