{
  "$schema": "../../schema/benchmark_scenario.schema.json",
  "id": "rbi-ml-also-data-fiduciary-2027",
  "description": "A Middle Layer NBFC that is also a Data Fiduciary has three distinct regimes and anchors after DPDP Rule 7 commences.",
  "entity_profile": {
    "entity_classes": [
      "nbfc.middle_layer",
      "dpdp.data_fiduciary"
    ],
    "is_listed": false,
    "holds_personal_data": true,
    "uses_protected_systems": false,
    "is_regulated_cloud_vps": false
  },
  "incident_facts": {
    "description": "Ransomware and personal data breach",
    "incident_types": [
      "Malicious code attacks such as Ransomware",
      "Data breach"
    ],
    "personal_data_involved": true,
    "when_detected": "2027-06-01T09:00:00+05:30",
    "when_noticed": "2027-06-01T10:00:00+05:30",
    "when_aware": "2027-06-01T11:00:00+05:30",
    "systems_affected": [
      "customer system"
    ]
  },
  "law_snapshot_date": "2027-06-01",
  "expected": {
    "law_as_of": "2027-06-01",
    "regulators": [
      "CERT-In",
      "RBI",
      "MeitY"
    ],
    "deadlines": [
      {
        "regulator": "RBI",
        "obligation_id": "rbi.nbfc-cyber.2026.ch5-incident-reporting-6h",
        "anchor": "detection",
        "deadline_iso8601": "PT6H",
        "deadline_timestamp": "2027-06-01T15:00:00+05:30"
      },
      {
        "regulator": "CERT-In",
        "obligation_id": "cert-in.directions-70b.2022.incident-reporting-6h",
        "anchor": "noticing",
        "deadline_iso8601": "PT6H",
        "deadline_timestamp": "2027-06-01T16:00:00+05:30"
      },
      {
        "regulator": "MeitY",
        "obligation_id": "meity.dpdp-rules.2025.rule7-2-b-board-detailed",
        "anchor": "awareness",
        "deadline_iso8601": "PT72H",
        "deadline_timestamp": "2027-06-04T11:00:00+05:30"
      }
    ],
    "citations": [
      {
        "obligation_id": "rbi.nbfc-cyber.2026.ch5-incident-reporting-6h",
        "instrument_id": "rbi.nbfc-cyber.2026",
        "paragraph_ref": "Paragraph 141, first sentence"
      },
      {
        "obligation_id": "rbi.nbfc-cyber.2026.ch5-cert-in-notification",
        "instrument_id": "rbi.nbfc-cyber.2026",
        "paragraph_ref": "Paragraph 141, second sentence"
      },
      {
        "obligation_id": "cert-in.directions-70b.2022.incident-reporting-6h",
        "instrument_id": "cert-in.directions-70b.2022",
        "paragraph_ref": "Direction (ii)"
      },
      {
        "obligation_id": "meity.dpdp-rules.2025.rule7-1-principal-intimation",
        "instrument_id": "meity.dpdp-rules.2025",
        "paragraph_ref": "Rule 7(1)"
      },
      {
        "obligation_id": "meity.dpdp-rules.2025.rule7-2-a-board-initial",
        "instrument_id": "meity.dpdp-rules.2025",
        "paragraph_ref": "Rule 7(2)(a)"
      },
      {
        "obligation_id": "meity.dpdp-rules.2025.rule7-2-b-board-detailed",
        "instrument_id": "meity.dpdp-rules.2025",
        "paragraph_ref": "Rule 7(2)(b)"
      }
    ],
    "required_evidence": [],
    "not_applicable": [],
    "unknowns": [],
    "time_critical": [
      "meity.dpdp-rules.2025.rule7-1-principal-intimation",
      "meity.dpdp-rules.2025.rule7-2-a-board-initial"
    ]
  },
  "adversarial_flags": [
    "multi_regime_entity",
    "three_distinct_anchors",
    "rbi_cert_in_notification_has_no_deadline"
  ],
  "split": "dev",
  "labels_source": "RBI NBFC Direction paragraph 141; CERT-In Direction (ii); DPDP Rule 7",
  "source_quotes": [
    {
      "document": "rbi.nbfc-cyber.2026",
      "page": 43,
      "quote": "within six hours of detection"
    },
    {
      "document": "rbi.nbfc-cyber.2026",
      "page": 44,
      "quote": "The NBFC shall also pro-actively notify Indian Computer \nEmergency Response Team (CERT-In) regarding cyber incidents."
    },
    {
      "document": "cert-in.directions-70b.2022",
      "page": 2,
      "quote": "within 6 hours of noticing such \nincidents or being brought to notice about such incidents."
    },
    {
      "document": "meity.dpdp-rules.2025",
      "page": 26,
      "quote": "(b) within seventy-two hours of becoming aware of the breach, or within such longer period as the \nBoard may allow on a request made in writing in this behalf"
    }
  ]
}
